<?xml version="1.0" encoding="UTF-8"?>
<!--
/**
 * Copyright Â© 2013-2017 Magento, Inc. All rights reserved.
 * See COPYING.txt for license details.
 */
-->
<config xmlns:xs="http://www.w3.org/2001/XMLSchema-instance" xs:noNamespaceSchemaLocation="../../../../../etc/config.xsd">
    <steps mode="settings">
        <step title="Settings Step">
            <integrity>Migration\Step\Settings\Integrity</integrity>
            <data>Migration\Step\Settings\Data</data>
        </step>
        <step title="Stores Step">
            <integrity>Migration\Step\Stores\Integrity</integrity>
            <data>Migration\Step\Stores\Data</data>
            <volume>Migration\Step\Stores\Volume</volume>
        </step>
    </steps>
    <steps mode="data">
        <step title="EAV Step">
            <integrity>Migration\Step\Eav\Integrity</integrity>
            <data>Migration\Step\Eav\Data</data>
            <volume>Migration\Step\Eav\Volume</volume>
        </step>
        <step title="Custom Customer Attributes Step">
            <integrity>Migration\Step\CustomCustomerAttributes\Integrity</integrity>
            <data>Migration\Step\CustomCustomerAttributes\Data</data>
            <volume>Migration\Step\CustomCustomerAttributes\Volume</volume>
        </step>
        <step title="Map Step">
            <integrity>Migration\Step\Map\Integrity</integrity>
            <data>Migration\Step\Map\Data</data>
            <volume>Migration\Step\Map\Volume</volume>
        </step>
        <step title="Url Rewrite step">
            <integrity>Migration\Step\UrlRewrite\Version11410to2000</integrity>
            <data>Migration\Step\UrlRewrite\Version11410to2000</data>
            <volume>Migration\Step\UrlRewrite\Version11410to2000</volume>
        </step>
        <step title="Log Step">
            <integrity>Migration\Step\Log\Integrity</integrity>
            <data>Migration\Step\Log\Data</data>
            <volume>Migration\Step\Log\Volume</volume>
        </step>
        <step title="Ratings Step">
            <integrity>Migration\Step\Ratings\Integrity</integrity>
            <data>Migration\Step\Ratings\Data</data>
            <volume>Migration\Step\Ratings\Volume</volume>
        </step>
        <step title="SalesOrder step">
            <integrity>Migration\Step\SalesOrder\Integrity</integrity>
            <data>Migration\Step\SalesOrder\Data</data>
            <volume>Migration\Step\SalesOrder\Volume</volume>
        </step>
    </steps>
    <steps mode="delta">
        <step title="Custom Customer Attributes Step">
            <delta>Migration\Step\CustomCustomerAttributes\Delta</delta>
            <volume>Migration\Step\CustomCustomerAttributes\Volume</volume>
        </step>
        <step title="Map step">
            <delta>Migration\Step\Map\Delta</delta>
        </step>
        <step title="Log Step">
            <delta>Migration\Step\Log\Delta</delta>
            <volume>Migration\Step\Log\Volume</volume>
        </step>
        <step title="SalesOrder step">
            <delta>Migration\Step\SalesOrder\Delta</delta>
            <volume>Migration\Step\SalesOrder\Volume</volume>
        </step>
    </steps>
    <source>
        <database host="localhost" name="magento1_integration" user="root"/>
    </source>
    <destination>
        <database host="localhost" name="magento2_integration" user="root"/>
    </destination>
    <options>
        <map_file>tests/integration/testsuite/Migration/_files/map.xml</map_file>
        <eav_map_file>tests/integration/testsuite/Migration/_files/ee.map-eav.xml</eav_map_file>
        <eav_attribute_groups_file>tests/integration/testsuite/Migration/_files/eav-attribute-groups.xml</eav_attribute_groups_file>
        <eav_document_groups_file>tests/integration/testsuite/Migration/_files/ee.eav-document-groups.xml</eav_document_groups_file>
        <log_map_file>tests/integration/testsuite/Migration/_files/map-log.xml</log_map_file>
        <settings_map_file>tests/integration/testsuite/Migration/_files/settings.xml</settings_map_file>
        <sales_order_map_file>tests/integration/testsuite/Migration/_files/map-sales.xml</sales_order_map_file>
        <delta_document_groups_file>tests/integration/testsuite/Migration/_files/deltalog.xml</delta_document_groups_file>
        <class_map>tests/integration/testsuite/Migration/_files/class-map.xml</class_map>
        <bulk_size>100</bulk_size>
        <source_prefix />
        <dest_prefix />
        <auto_resolve_urlrewrite_duplicates>1</auto_resolve_urlrewrite_duplicates>
        <edition_migrate>ee-to-ee</edition_migrate>
        <init_statements_source>SET NAMES utf8;</init_statements_source>
        <init_statements_destination>SET NAMES utf8;</init_statements_destination>
    </options>
</config>
