<?xml version="1.0" encoding="UTF-8"?>
<!--
/**
 * Copyright Â© 2015 Magento. All rights reserved.
 * See COPYING.txt for license details.
 */
-->
<config xmlns:xs="http://www.w3.org/2001/XMLSchema-instance" xs:noNamespaceSchemaLocation="../../../../../etc/config.xsd">
    <steps mode="settings">
        <step title="Settings step">
            <integrity>Migration\Step\Settings</integrity>
            <data>Migration\Step\Settings</data>
        </step>
        <step title="Stores step">
            <integrity>Migration\Step\Stores</integrity>
            <data>Migration\Step\Stores</data>
            <volume>Migration\Step\Stores</volume>
        </step>
    </steps>
    <steps mode="data">
        <step title="EAV Step">
            <integrity>Migration\Step\Eav\Integrity</integrity>
            <data>Migration\Step\Eav\Data</data>
            <volume>Migration\Step\Eav\Volume</volume>
        </step>
        <step title="Map step">
            <integrity>Migration\Step\Map\Integrity</integrity>
            <data>Migration\Step\Map\Data</data>
            <volume>Migration\Step\Map\Volume</volume>
        </step>
        <step title="Url Rewrite step">
            <integrity>Migration\Step\UrlRewrite\Version191to2000</integrity>
            <data>Migration\Step\UrlRewrite\Version191to2000</data>
            <volume>Migration\Step\UrlRewrite\Version191to2000</volume>
        </step>
        <step title="Log Step">
            <integrity>Migration\Step\Log\Integrity</integrity>
            <data>Migration\Step\Log\Data</data>
            <volume>Migration\Step\Log\Volume</volume>
        </step>
        <step title="Ratings step">
            <integrity>Migration\Step\Ratings</integrity>
            <data>Migration\Step\Ratings</data>
            <volume>Migration\Step\Ratings</volume>
        </step>
    </steps>
    <steps mode="delta">
        <step title="Map step">
            <delta>Migration\Step\Map\Delta</delta>
            <volume>Migration\Step\Map\Volume</volume>
        </step>
        <step title="Log Step">
            <delta>Migration\Step\Log</delta>
            <volume>Migration\Step\Log</volume>
        </step>
        <step title="SalesOrder step">
            <delta>Migration\Step\SalesOrder</delta>
            <volume>Migration\Step\SalesOrder</volume>
        </step>
    </steps>
    <source version="1.9.1">
        <database host="localhost" name="magento1_integration" user="root"/>
    </source>
    <destination version="2.0.0.0">
        <database host="localhost" name="magento2_integration" user="root"/>
    </destination>
    <options>
        <map_file>tests/integration/testsuite/Migration/_files/map.xml</map_file>
        <eav_map_file>tests/integration/testsuite/Migration/_files/map-eav.xml</eav_map_file>
        <eav_attribute_groups_file>tests/integration/testsuite/Migration/_files/eav-attribute-groups.xml</eav_attribute_groups_file>
        <eav_document_groups_file>tests/integration/testsuite/Migration/_files/eav-document-groups.xml</eav_document_groups_file>
        <log_map_file>tests/integration/testsuite/Migration/_files/map-log.xml</log_map_file>
        <log_document_groups_file>tests/integration/testsuite/Migration/_files/log-document-groups.xml.dist</log_document_groups_file>
        <settings_map_file>tests/integration/testsuite/Migration/_files/settings.xml</settings_map_file>
        <sales_order_map_file>tests/integration/testsuite/Migration/_files/map-sales.xml</sales_order_map_file>
        <delta_document_groups_file>tests/integration/testsuite/Migration/_files/deltalog.xml</delta_document_groups_file>
        <class_map>tests/integration/testsuite/Migration/_files/class-map.xml</class_map>
        <bulk_size>100</bulk_size>
        <source_prefix />
        <dest_prefix />
        <auto_resolve_urlrewrite_duplicates>1</auto_resolve_urlrewrite_duplicates>
    </options>
</config>
